{
  "contract": "mreader.postgres-roles",
  "version": 1,
  "authorities": ["contracts/ownership/routes.v1.json","docs/qualification/RC485-TABLE-DISPOSITION.md","deploy/docker-desktop-hybrid/env-scopes"],
  "capabilities": [
    {"acceptance_test_ids":["OWN-01"],"grants":[{"columns":[],"object_type":"table","privileges":["insert","select","update"],"resource":"users"}],"login":"NOLOGIN","name":"auth_runtime","role_attributes":[]},
    {"acceptance_test_ids":["OWN-01"],"grants":[{"columns":[],"object_type":"table","privileges":["delete","insert","select","update"],"resource":"announcements"},{"columns":[],"object_type":"table","privileges":["select"],"resource":"bookmarks"},{"columns":[],"object_type":"table","privileges":["insert","select","update"],"resource":"catalog_mutation_receipts"},{"columns":[],"object_type":"table","privileges":["delete","insert","select","update"],"resource":"chapters"},{"columns":[],"object_type":"table","privileges":["delete","insert","select","update"],"resource":"editor_picks"},{"columns":[],"object_type":"table","privileges":["insert","select","update"],"resource":"genres"},{"columns":[],"object_type":"sequence","privileges":["usage"],"resource":"genres_id_seq"},{"columns":[],"object_type":"table","privileges":["select"],"resource":"ingestion_operations"},{"columns":[],"object_type":"table","privileges":["insert","select"],"resource":"lifecycle_cleanup_jobs"},{"columns":[],"object_type":"table","privileges":["select"],"resource":"media_operations"},{"columns":[],"object_type":"table","privileges":["select"],"resource":"pages"},{"columns":[],"object_type":"table","privileges":["select"],"resource":"scraper_batch_uploads"},{"columns":[],"object_type":"table","privileges":["select"],"resource":"scraper_drafts"},{"columns":[],"object_type":"table","privileges":["select"],"resource":"scraper_series_drafts"},{"columns":[],"object_type":"table","privileges":["delete","insert","select","update"],"resource":"series"},{"columns":[],"object_type":"table","privileges":["delete","insert","select"],"resource":"series_genres"},{"columns":[],"object_type":"table","privileges":["select"],"resource":"series_ratings"},{"columns":[],"object_type":"table","privileges":["delete","insert","select"],"resource":"series_tags"},{"columns":[],"object_type":"table","privileges":["select"],"resource":"series_trending_hourly"},{"columns":[],"object_type":"table","privileges":["insert","select","update"],"resource":"tags"},{"columns":[],"object_type":"sequence","privileges":["usage"],"resource":"tags_id_seq"},{"columns":[],"object_type":"table","privileges":["select"],"resource":"users"}],"login":"NOLOGIN","name":"catalog_runtime","role_attributes":[]},
    {"acceptance_test_ids":["OWN-01"],"grants":[{"columns":[],"object_type":"table","privileges":["insert","select","update"],"resource":"database_operations"},{"columns":[],"object_type":"table","privileges":["select"],"resource":"database_protection_runtime"},{"columns":[],"object_type":"table","privileges":["select"],"resource":"database_recovery_points"}],"login":"NOLOGIN","name":"database_protection_api_runtime","role_attributes":[]},
    {"acceptance_test_ids":["OWN-01"],"grants":[{"columns":[],"object_type":"table","privileges":["select"],"resource":"chapters"},{"columns":[],"object_type":"table","privileges":["select"],"resource":"media_operations"},{"columns":[],"object_type":"table","privileges":["select"],"resource":"pages"},{"columns":[],"object_type":"table","privileges":["select"],"resource":"series"}],"login":"NOLOGIN","name":"image_runtime","role_attributes":[]},
    {"acceptance_test_ids":["OWN-01"],"grants":[{"columns":[],"object_type":"table","privileges":["select"],"resource":"event_outbox"},{"columns":[],"object_type":"table","privileges":["select"],"resource":"lifecycle_cleanup_jobs"},{"columns":[],"object_type":"table","privileges":["select"],"resource":"media_operations"},{"columns":[],"object_type":"table","privileges":["select"],"resource":"scraper_batch_items"},{"columns":[],"object_type":"table","privileges":["select"],"resource":"scraper_series_draft_chapters"},{"columns":[],"object_type":"table","privileges":["select"],"resource":"scraper_series_drafts"},{"columns":[],"object_type":"table","privileges":["select"],"resource":"scraper_storage_attempts"}],"login":"NOLOGIN","name":"keda_metrics_runtime","role_attributes":[]},
    {"acceptance_test_ids":["OWN-01"],"grants":[{"columns":[],"object_type":"table","privileges":["delete","select","update"],"resource":"lifecycle_cleanup_jobs"},{"columns":[],"object_type":"table","privileges":["select"],"resource":"media_operations"},{"columns":[],"object_type":"table","privileges":["select"],"resource":"pages"},{"columns":[],"object_type":"table","privileges":["select"],"resource":"scraper_batch_items"},{"columns":[],"object_type":"table","privileges":["select"],"resource":"scraper_drafts"},{"columns":[],"object_type":"table","privileges":["select"],"resource":"scraper_series_draft_chapters"},{"columns":[],"object_type":"table","privileges":["select"],"resource":"scraper_series_drafts"},{"columns":[],"object_type":"table","privileges":["insert","select","update"],"resource":"scraper_staging_spool_registry"},{"columns":[],"object_type":"table","privileges":["select","update"],"resource":"scraper_storage_attempts"},{"columns":[],"object_type":"table","privileges":["select"],"resource":"series"}],"login":"NOLOGIN","name":"lifecycle_worker_runtime","role_attributes":[]},
    {"acceptance_test_ids":["OWN-01"],"grants":[{"columns":[],"object_type":"table","privileges":["select"],"resource":"chapters"},{"columns":[],"object_type":"table","privileges":["insert","select","update"],"resource":"ingestion_operations"},{"columns":[],"object_type":"table","privileges":["select","update"],"resource":"lifecycle_cleanup_jobs"},{"columns":[],"object_type":"table","privileges":["insert","select","update"],"resource":"media_operations"},{"columns":[],"object_type":"table","privileges":["select"],"resource":"pages"},{"columns":[],"object_type":"table","privileges":["select"],"resource":"series"}],"login":"NOLOGIN","name":"media_runtime","role_attributes":[]},
    {"acceptance_test_ids":["OWN-01"],"grants":[{"columns":[],"object_type":"table","privileges":["select"],"resource":"bookmarks"},{"columns":[],"object_type":"table","privileges":["insert","select","update"],"resource":"notification_event_receipts"},{"columns":[],"object_type":"table","privileges":["insert","select"],"resource":"notifications"},{"columns":[],"object_type":"table","privileges":["select"],"resource":"series"},{"columns":[],"object_type":"table","privileges":["select"],"resource":"subscriptions"}],"login":"NOLOGIN","name":"notification_worker_runtime","role_attributes":[]},
    {"acceptance_test_ids":["OWN-01"],"grants":[{"columns":[],"object_type":"function","privileges":["execute"],"resource":"enqueue_event_outbox_v1"},{"columns":[],"object_type":"table","privileges":["insert"],"resource":"event_outbox"}],"login":"NOLOGIN","name":"outbox_producer_runtime","role_attributes":[]},
    {"acceptance_test_ids":["OWN-01"],"grants":[{"columns":[],"object_type":"table","privileges":["select","update"],"resource":"event_outbox"}],"login":"NOLOGIN","name":"outbox_relay_runtime","role_attributes":[]},
    {"acceptance_test_ids":["OWN-01"],"grants":[{"columns":[],"object_type":"table","privileges":["insert","select","update"],"resource":"chapter_reads"},{"columns":[],"object_type":"table","privileges":["select"],"resource":"chapters"},{"columns":[],"object_type":"table","privileges":["insert","select","update"],"resource":"reading_progress"},{"columns":[],"object_type":"view","privileges":["select"],"resource":"reading_state_v1"},{"columns":[],"object_type":"table","privileges":["select"],"resource":"series"},{"columns":[],"object_type":"table","privileges":["select"],"resource":"users"}],"login":"NOLOGIN","name":"progress_runtime","role_attributes":[]},
    {"acceptance_test_ids":["OWN-01"],"grants":[{"columns":[],"object_type":"table","privileges":["select"],"resource":"chapter_reads"},{"columns":[],"object_type":"table","privileges":["select"],"resource":"chapters"},{"columns":[],"object_type":"table","privileges":["select"],"resource":"genres"},{"columns":[],"object_type":"table","privileges":["select"],"resource":"pages"},{"columns":[],"object_type":"table","privileges":["select"],"resource":"reading_progress"},{"columns":[],"object_type":"table","privileges":["select"],"resource":"series"},{"columns":[],"object_type":"table","privileges":["select"],"resource":"series_genres"},{"columns":[],"object_type":"table","privileges":["select"],"resource":"series_tags"},{"columns":[],"object_type":"table","privileges":["delete","insert","select","update"],"resource":"series_trending_hourly"},{"columns":[],"object_type":"table","privileges":["select"],"resource":"tags"}],"login":"NOLOGIN","name":"reader_runtime","role_attributes":[]},
    {"acceptance_test_ids":["OWN-01"],"grants":[{"columns":[],"object_type":"table","privileges":["select"],"resource":"comments"},{"columns":[],"object_type":"table","privileges":["select"],"resource":"notifications"},{"columns":[],"object_type":"table","privileges":["select"],"resource":"series"},{"columns":[],"object_type":"table","privileges":["select"],"resource":"subscriptions"}],"login":"NOLOGIN","name":"realtime_runtime","role_attributes":[]},